<?xml version="1.0"?>
<!DOCTYPE site PUBLIC "-//TangibleBit//DTD siteDef 1.0//EN" "http://tangiblebit.com/dtd/site.dtd">
<site id="1">
	<name>Testsite</name>
	<locname>Antarctica</locname>
	<longitude>0</longitude>
	<latitude>-90.0</latitude>
	<website>http://antarcticfablab.int</website>
	<access>Fab Lab</access>
	<equipment>
		<equipment-item>
			<type>Epilog Mini 24</type>
			<maker>Epilog</maker>
			<capabilities>
				<capability>Laser Cutter</capability>
			</capabilities>
		</equipment-item>
		<equipment-item>
			<type>Shopbot PRSAlpha 96</type>
			<maker>Shopbot tools</maker>
			<capabilities>
				<capability>CNC Mill</capability>
			</capabilities>
		</equipment-item>
	</equipment>
</site>
